Image link,Event name,Theme,Location,Start date option 1,Start date option 2,Start date option 3,Description,Price,Website
https://classbento.co.uk/images/class/scarf-knitting-course-london-portrait-big.jpg?1699877817,"Scarf Knitting Course
",Textiles,"Make Town - 32 Vyner Street, London, E2 9DQ, England

","Saturday 17th February, 10:00am - 12:00pm. 3 weeks same day and time","Saturday 24th February, 10:00am - 12:00pm
3 weeks same day and time","Saturday 2nd March, 10:00am - 12:00pm
3 weeks same day and time","Week 1: Kickstart your knitting journey! Learn to select the right fibre and tools, master basic stitches, and start your own scarf.
Weeks 2 & 3: Scarf progress! Follow or tweak your pattern to complete your cozy creation. Ready for a new project? We've got you covered.
Get a complete knitting intro with weekly guidance and finish with a fabulous scarf. Ideal for beginners or as a refresher, boosting confidence for bigger projects.
Workshop includes all tools, but bring 500m of yarn for your custom scarf. Mix and match up to 5 colors for a personalized touch. Let's craft your dream scarf together!",£80,https://classbento.co.uk/scarf-knitting-course-london
https://classbento.co.uk/images/class/crochet-fundamentals-course-london-portrait-big.jpg?1690799384,"Crochet Fundamentals Course
",Textiles,"Four Otter Craft Studio - Blue House Yard, River Park Road, Wood Green, N22 7TB

","Saturday 10th February, 10am - 12pm 3 weeks same day and time","Wednesday 3rd April, 6:30 -  8:30pm 3 weeks same day and time",,"Embark on a 3-week crochet adventure! From zero to crochet hero, learn all the essentials with our expert Nessa guiding every step.
Week 1: Dive into crochet basics - master hook grips, chain stitching, and fundamental stitches for a solid foundation.
Week 2: Get creative with granny squares - explore patterns, colors, and the magic of geometric crochet.
Week 3: Enter the whimsical world of amigurumi - craft charming characters and bring your crochet to life.
Perfect for beginners or a refresher, with all materials provided. Join our crafting community and start your crochet journey with confidence!",£120,https://classbento.co.uk/crochet-fundamentals-course-london
https://classbento.co.uk/images/class/mosaic-making-course-five-weeks-london-portrait-big.jpg?1666106627,Mosaic Making Course,Arts and Crafts,"31 Jeffreys Rd, London SW4 6QU
","Tuesday 6th February, 6:30 - 9:30pm 5 weeks same day and time",,,"Discover the timeless craft of mosaics in a 5-week flexible course at Art4Space in Clapham. Delve into glass art with the guidance of experienced mosaic artists.
Enjoy a laid-back studio vibe with garden access, perfect for creative exploration. No rush—complete your sessions any Tuesday night within 6 months.
Start with the basics and advance your skills through diverse projects like tiles, plant pots, and mirror frames, with all materials supplied.
End the course equipped with valuable mosaic techniques and handcrafted pieces to cherish or gift. A gateway to continued artistic adventures at home!",£144,https://classbento.co.uk/mosaic-making-course-five-weeks-london
https://classbento.co.uk/images/class/knitting-fundamentals-course-london-portrait-big.jpg?1696527463,"Knitting Fundamentals Course
",Textiles,"Four Otter Craft Studio - Blue House Yard, River Park Road, Wood Green, N22 7TB
","Wednesday 7th February, 6:30 - 8:30 3 weeks same day and time  ","Saturday 13th February, 10am - 12pm 3 weeks same day and time",,"Join our 3-week knitting course and evolve from beginner to confident knitter, ready to tackle any yarn project with zeal!
Learn knitting essentials in a supportive environment: casting on, knit and purl stitches, ribbing, moss stitch, and casting off, all under the guidance of our friendly instructor.
Week by week, deepen your understanding of knitting techniques and principles, turning your projects into masterpieces.
By the course's end, you'll be adept at knitting, equipped to explore complex stitches or start your own DIY project. Start your knitting adventure now and watch your creations come to life!",£120,https://classbento.co.uk/knitting-fundamentals-course-london
https://www.handsonpottery.org/uploads/2/5/3/3/25338201/handsonpottery-mo-mi-82_orig.jpg,"Introductory Pottery Course",Pottery,"The Rosemary Organic Hungarian Restaurant - 178 New Cross Road, New Cross Gate, SE14 5AA, England

",Satuday 10th February 10am - 12pm 4 weeks same day and time ,Sunday 11th February 10am - 12pm 4 weeks same day and time,Satuday 17th February 10am - 12pm 4 weeks same day and time ,"Dive into the world of pottery with our 4-week course, perfect for beginners or those seeking a refresher in ceramics.
Learn essential skills: wheel throwing, handle pulling, turning, glazing, and firing, all under expert guidance.
Enjoy access to all necessary tools and materials, with personalized tips and support from your experienced tutor.
Complete the course with your own finished pottery pieces, and keep honing your skills with studio practice at £4/hour or rent a portable wheel for £20/week.
Flexible start dates available for both public and private classes, ensuring a perfect fit for your schedule.",£220,https://classbento.co.uk/introductory-pottery-course-london-0 
https://classbento.co.uk/images/class/memory-bear-crafting-course-bromley-portrait-big.jpg?1704384969,"Memory Bear Crafting Course",Arts and Crafts,"The Hub from Greener and Cleaner, The Glades, Bromley, BR1 1DN
",Sunday 18th February 1pm - 4pm 3 weeks same day and time ,,,"Transform cherished fabrics into memory bears in our two-part workshop, perfect for capturing life's special moments.
Learn design, pattern tracing, fabric cutting, machine and hand stitching, and bear assembly. Celebrate your creation with a final showcase!
Embrace creativity, sustainability, and the joy of crafting in a supportive environment.",£70,https://classbento.co.uk/memory-bear-crafting-course-bromley
https://classbento.co.uk/images/class/taster-sewing-course-southall-portrait-big.jpg?1694691218,"Taster Sewing Course",Textiles,"Rectory park community centre - 245 Rectory Park Av., Northolt, UB5 6SD, England
","Saturday 17th February, 10:00am - 12:00pm. 2 weeks same day and time","Saturday 16th March, 10:00am - 12:00pm. 2 weeks same day and time","Saturday 13th April, 10:00am - 12:00pm. 2 weeks same day and time","Dive into sewing with our beginner-friendly class in Northolt, West London. Perfect for fashion enthusiasts looking to start without the high costs.
Join two 3-hour sessions on Saturdays monthly, learning threading, bobbin setup, invisible zips, and French seams.
Enjoy a supportive, welcoming atmosphere ideal for mastering sewing basics and creating your first tote bag or cushion.
Experiment with various fabrics under the guidance of our experienced instructor, finding your unique style.
Transform your sewing apprehension into confidence, leaving with new skills, creations, and the readiness to tackle more complex projects.",£50,https://classbento.co.uk/taster-sewing-course-southall
https://classbento.co.uk/images/class/beginner-crochet-course-london-0-portrait-big.jpg?1682701907,"Beginner Crochet Course
",Textiles,"205 Holland Park Avenue, London, W11 4XB, England

","Wednesday 7th February, 6:30 - 8:30 13 weeks same day and time  ","Friday 9th February, 5:30 - 7:30 13 weeks same day and time","Thursday 7th March, 5:30 - 7:30 13 weeks same day and time","Jumpstart your crochet journey with our Beginner Crochet Course, tailored for absolute beginners and those looking to enhance their skills.
Master crochet basics: from holding your hook and making foundational stitches to advanced techniques and reading patterns.
Enjoy personalized guidance in this one-to-one course, ensuring focused learning and progress.
Finish with the ability to tackle various projects, boosted confidence, and a certificate of achievement to mark your accomplishments.
Note for cat lovers and those with allergies: the presence of two young cats in the crafting space. Measures will be taken to minimize their impact, but a cat-free environment cannot be guaranteed.",£195,https://classbento.co.uk/beginner-crochet-course-london-0
https://classbento.co.uk/images/class/one-to-one-drawing-course-6-weeks-london-portrait-big.jpg?1671460531,"One-to-one Drawing Course 
",Arts and Crafts,"Reading Room, Wellcome Collection, 183 Euston Road, Euston, London, NW1 2BE
","Saturday 17th February, 10:30am - 11:30am 6 weeks same day and time","Saturday 30th March, 1:00pm - 2:00pm. 6 weeks same day and time","Saturday 11th May, 11:45am - 12:45pm. 6 weeks same day and time","Embark on a drawing adventure in London with our one-on-one course tailored for beginners. Unlock your artistic potential over six sessions.
Enjoy personalized instruction from a local fine art expert in the serene setting of the Wellcome Collection's Reading Room in Euston.
Explore a variety of drawing techniques using graphite pencils, with the freedom to focus on subjects that inspire you, from still-life to portraiture.
Perfect for all ages seeking a creative outlet or a boost to academic art portfolios. All materials provided; just bring your passion for art!",£165,https://classbento.co.uk/one-to-one-drawing-course-6-weeks-london
https://classbento.co.uk/images/class/ceramic-plant-pot-mosaic-making-course-london-portrait-big.jpg?1703005559,"Ceramic Plant Pot Mosaic Making Course",Arts and Crafts,"Bee Urban - St Agnes place se11 4be

",Wednesday 13th March 5pm - 8pm. 2 weeks same day and time,,,"Dive into the art of mosaic making with our two-week workshop, crafting a unique ceramic plant pot. Session 1: Plan and start your mosaic masterpiece. Session 2: Complete and prepare to grout your piece at home.
Enjoy expert guidance from our tutor Kes, along with refreshments, a variety of stunning mosaic tiles, and a grouting demo in the final week.",£70,https://classbento.co.uk/ceramic-plant-pot-mosaic-making-course-london
https://classbento.co.uk/images/class/wheel-throwing-course-five-weeks-london-portrait-big.jpg?1652966452,Wheel Throwing Course,Pottery,"Sak Beh Studio Pottery - 3 Garnham Street, London, N16 7JA, England","Satuday 3rd February, 3pm - 5pm. 5 weeks same day and time ","Sunday 11th February, 10am - 12pm. 5 weeks same day and time ","Saturday 9th March, 3pm - 5pm. 5 weeks same day and time","Kickstart your pottery journey with our 5-week wheel throwing course in London, designed for beginners. Craft and take home your own pottery pieces, with all materials and firings included.
Week 1: Dive into clay preparation, wheel throwing basics, and practice shaping your pot.
Week 2: Enhance your skills with more complex forms and learn to use shaping tools for taller creations.
Week 3: Master the art of trimming, shaping, and adding foot rings to your pots.
Week 4: Explore decoration techniques using colored slips and surface patterns for unique designs.
Week 5: Complete your creations with glazing, choosing from 14 beautiful glaze options.
Collect your finished work two weeks post-course, available for a month due to storage constraints. Join us for a hands-on experience and leave with new skills and beautiful pottery!",£230,https://classbento.co.uk/wheel-throwing-course-five-weeks-london
https://classbento.co.uk/images/class/quilting-sewing-course-portrait-big.jpg?1657277901,"Quilting Sewing Course
",Textiles,"Craft My Day - 42 Central Road, Worcester Park, Kt4 8hy

","Tuesday 6th February, 6:45- 9:45pm4 weeks same day and time",,,"Craft your own quilt in a 4-week sewing class in Worcester Park, under the guidance of experienced tutor Anna from The Sewing Nut Studio.
Learn quilting essentials: design, cutting, patchworking, and binding, with a focus on the quilting stitch to bring layers together.
Explore various methods and choose the best for your project, creating a lap or cot-sized quilt with personalized guidance.
Bring your own fabric to infuse personal style into your quilt, with detailed prep instructions provided.
Conclude with inspiration for future projects and resources to continue your quilting journey, celebrating your newfound skills and beautiful creation.",£175,https://classbento.co.uk/quilting-sewing-course
https://classbento.co.uk/images/class/beginners-crochet-course-london-portrait-big.jpg?1682598251,"Beginners' Crochet Course",Textiles,"Four Otter Craft Studio, Blue House Yard, Wood Gre - River Park Road, Alexandra Palace, N22 7TB, England
",Satuday 10th February 10am - 12pm 3 weeks same day and time ,"Wednesday 3rd April, 6:30 - 8:30pm. 3 weeks same day and time",,"Embark on a crochet journey with our 3-week course, transforming beginners into skilled enthusiasts ready for more complex projects.
Learn essential crochet skills: chaining, basic stitches (single, double, treble), crafting a granny square, and creating an amigurumi sphere.
Benefit from the support and hands-on guidance of our friendly instructor, perfecting your technique and building confidence.
Complete the course ready to explore adventurous stitches or begin your own DIY crochet projects, equipped with a solid foundation in crochet fundamentals.",£120,https://classbento.co.uk/beginners-crochet-course-london
https://classbento.co.uk/images/class/4-week-painting-course-london-portrait-big.jpg?1704663809,"4 Week Painting Course
",Arts and Crafts,"Two more years - 7 Roach Rd Fish Island Hackney Wick London E3 2PA

","Thursday 22nd February, 7pm - 9pm  - 3 weeks same day and time ","Sunday 24th March, 6:30pm - 8:30pm - 3 weeks same day and time ",,"Join us for a 4-week acrylic painting course in which we will cover fundamental techniques, colour theory, brushwork, and composition. Each week will focus on a specific aspect, gradually building your skills. Expect hands-on practise, constructive feedback, and the opportunity to explore your artistic style. The course aims to provide a solid foundation for expressing your creativity through acrylics.

You'll have the privilege of learning from a trained artist in a charming canal-side creative venue. The cosy upstairs studio provides an inspiring atmosphere, and you'll also have the option to enjoy drinks and food available at the restaurant downstairs, making it a delightful artistic experience.",£150,https://classbento.co.uk/4-week-painting-course-london
https://classbento.co.uk/images/class/beginners-crochet-course-london-portrait-big.jpg?1682598251,"Beginners' Crochet Course
",textiles,"Four Otter Craft Studio, Blue House Yard, Wood Gre - River Park Road, Alexandra Palace, N22 7TB, England

","Satuday 10th February, 10am - 12pm - 3 weeks same day and time","Wednesday 3rd April, 6:30 - 8:30pm. 3 weeks same day and time",,"Always wanted to know how to crochet? This fun and friendly course will take you from novice knitter to natural in just three weeks!

During this basic crochet class, you will learn:
How to chain
How to make basic stitches - single, double and treble crochet
How to make a granny square
How to make an amigurumi sphere

Throughout this course, you will receive support and hands-on help from your friendly teacher as you learn fundamental techniques and best practise – get ready to unleash your inner hooker!

At the end of this fun craft course, you will have built up your confidence to move onto the next class, and tackle more adventurous stitches or to tackle your first DIY project.",£120,https://classbento.co.uk/beginners-crochet-course-london
https://classbento.co.uk/images/class/printmaking-course-london-portrait-big.jpg?1624454018,"Printmaking Course
",Arts and Crafts,"Unit 151 Battersea Business Centre, 99-109 Lavender Hill, Battersea, SW11 5QL
","Monday 26th February, 7pm - 9pm - 4 weeks same day and time ",,,"Dive into the art of printmaking with Lavender Print School's four-week course, perfect for beginners and enthusiasts alike.
Learn key techniques: lino printing, drypoint, image transfer, and diverse mark-making with various tools.
Experiment with oil and water-based inks, master registration, and explore the Chine-collé technique for added depth.
Experience hands-on learning with passionate printmaker Lorenzo, ready to inspire and guide you through your printmaking journey.
Finish with newfound confidence, a wealth of printmaking knowledge, and a collection of your own handmade prints to treasure.",£160,https://classbento.co.uk/printmaking-course-london
https://classbento.co.uk/images/class/acrylic-painting-course-london-portrait-big.jpg?1683196700,"Acrylic Painting Course",Arts and Crafts,"Southgate methodist church - N14 6RS

","Tuesday 20th February, 8pm - 9:30pm - 6 week same day and time ","Tuesday 27th February, 8pm - 9:30pm - 6 week same day and time ","Tuesday 5th March, 8pm - 9:30pm - 6 week same day and time ","Unleash your creativity with a six-week acrylic art course guided by experienced artist Gee. Perfect for all skill levels, from novices to seasoned painters.
Discover the versatility of acrylics and watercolors through engaging sessions, introducing new techniques and processes each week.
Enjoy a relaxed atmosphere filled with good vibes, ideal for exploring artistic expression and refining your painting skills.
Benefit from Gee's step-by-step guidance, covering various painting techniques, ensuring you develop confidence and proficiency in your art.",£155,https://classbento.co.uk/acrylic-painting-course-london
https://classbento.co.uk/images/class/freestyle-painting-course-london-portrait-big.jpg?1674739008,"Freestyle Painting Course",Arts and Crafts,"Southgate methodist church - N14 6RS
","Tuesday 20th February, 7pm - 8:30pm - 6 week same day and time ","Tuesday 27th February, 7pm - 8:30pm - 6 week same day and time ","Tuesday 5th March, 7pm - 8:30pm - 6 week same day and time ","Ignite your artistic passion with a dynamic six-week painting course led by the talented Gee. Explore a range of mediums including acrylics, spray paint, watercolors, and oils.
Dive into each class with excitement, learning diverse artistic skills and techniques that will bring your creative visions to life.
Choose your theme and embark on a journey to create personal and meaningful artwork, experiencing a variety of exciting outcomes.
Ideal for unwinding and connecting with your inner artist, this course promises inspiration, new knowledge, and a deeper engagement with art.",£160,https://classbento.co.uk/freestyle-painting-course-london
https://classbento.co.uk/images/class/portrait-painting-course-for-beginners-london-portrait-big.jpg?1646842705,"Portrait Painting Course for Beginners",Arts and Crafts,"ARTS THEATRE - Great Newport Street, London, WC2H 7JB, England

","Monday 19th April, 6:45pm - 9:15pm - 3 weeks same day and time ","Monday 13th May, 6:45pm - 9:15pm - 3 weeks same day and time ",,"Unleash your artistic talents in a three-week portrait painting course led by a skilled artist, complete with all necessary art supplies.
Perfect for both beginners and those looking to enhance their skills, this London-based course offers a creative escape and skill-building in a relaxed setting.
Gain a strong foundation in portrait essentials, from capturing likenesses to mastering composition and brush techniques.
Delve into a variety of mediums including drawing, pastels, and painting, honing your skills in shading, proportions, and tone.
The course unfolds in stages: starting with understanding facial structures and sketching self-portraits, advancing to working with models and exploring color theory, and culminating in creating a detailed portrait with water-mixable oil paints.
Walk away with newfound skills, a deeper understanding of portrait painting, and your own completed works to inspire future creations.",£125,https://classbento.co.uk/portrait-painting-course-for-beginners-london
https://classbento.co.uk/images/class/silver-jewellery-course-5-week-term-bromley-portrait-big.jpg?1706534081,Silver Jewellery Course,Jewellery,"Manor Park, Chislehurst, BR7 5QE

","Sunday 25th February, 6:30pm - 9:30pm - 5 weeks same day and time ","Sunday 10th March, 6:30pm - 9:30pm - 5 weeks same day and time ","Sunday 13th May, 6:30pm - 9:30pm - 5 weeks same day and time ","Embark on your journey learning the fundamentals of handcrafting your own silver jewellery in our Beginner Silver Jewellery course.

Over the course of 5 Mondays, this beginner-friendly course will guide you through fundamental techniques and skills to be able to transform metal into your own wearable jewellery.

Learn through hands-on projects to:
Size and make the perfect-fitting silver ring
Master soldering through fabricating a chain-link bracelet
Pierce/saw sheet metal to craft your own pendant
Texture, file, shape, finish, and so much more!

The class is suitable for complete beginners or improvers who want to hone their skills.

By the end of this immersive beginner jewellery-making experience, you'll not only have your own creations to keep but also the skills to make more!",£242,https://classbento.co.uk/silver-jewellery-course-5-week-term-bromley
https://classbento.co.uk/images/class/introduction-to-drawing-4-week-course-london-portrait-big.jpg?1698932065,"Introduction to Drawing
",Arts and Crafts,"Art Play - 16 horner square, E16EW

","Monday 4th March, 6pm - 8pm - 4 weeks same day and time ","Monday 29th April, 6:45pm - 9:15pm - 3 weeks same day and time ",,"Discover your artistic flair with Art Play London's ""Introduction to Drawing"" course, spanning four weeks of immersive learning and creativity.
Delve into essential drawing principles, mastering line, shape, form, composition, and perspective, suitable for beginners or those refining their skills.
Experiment with various pencil types, understanding their unique properties to enhance your drawings with depth and texture.
Learn advanced shading techniques like hatching, cross-hatching, blending, and stippling, adding dimension to your artwork.
Enhance your observational skills, accurately capturing the essence of subjects with guidance from a skilled artist.
Enjoy personalized instruction in a small class setting, with all necessary materials provided, welcoming all skill levels.
Course breakdown: Week 1 focuses on drawing fundamentals, Week 2 on pencil techniques, Week 3 on shading and texture, concluding with Week 4's observational drawing.
Embrace the joy of drawing in a supportive environment, unlocking your potential at Art Play London.",£146,https://classbento.co.uk/introduction-to-drawing-4-week-course-london
https://classbento.co.uk/images/class_extra/ceramics-course-6-weeks-london-5-portrait-big.jpg?1666627663,Ceramics Course,Pottery,"The Ceramicists - SPACE Studios, Unit 4G, 90 Haymerle Road, SE15 6SB London

","Sunday 3rd March, 4:30pm - 7pm - 6 weeks same day and time ",Monday 4th March 6:30pm - 9pm - 6 weeks same day and time  ,,"Jump into the world of pottery with our comprehensive six-session course in London, perfect for beginners eager to craft their own ceramic creations.
Gain a robust foundation in all key pottery techniques: from hand-building, slip casting, and wheel throwing, to slab building and sculpting with coils, ensuring you're well-equipped to continue independently.
Week-by-week breakdown:
Week 1: Start with an overview of pottery, studio safety, and dive into pinching pots, concluding with an introduction to glazing.
Week 2: Explore coiling techniques for vessels or sculptures, embracing one of the oldest sculpting methods.
Week 3: Discover slab building, focusing on structural and geometric designs.
Week 4: Learn the art of wheel throwing and experience slip casting to create precise bowl or cup shapes.
Week 5: Unleash your creativity in decorating, using underglazes, slips, and various texturing methods.
Week 6: Finish your pieces with glazing, applying techniques like brushing, pouring, or dipping to achieve the perfect look.
Materials, including clay and glaze, are provided, with a nominal fee for firing based on the size of your creations.
Conclude the course with a rich understanding of pottery, your own handmade ceramics, and perhaps even a new circle of pottery enthusiasts!",£240,https://classbento.co.uk/ceramics-course-6-weeks-london
https://classbento.co.uk/images/class_extra/mosaic-making-course-london-3-portrait-big.jpg?1621592584,"Mosaic Making Course
",Arts and Crafts,"Art4Space Art Centre - Studio 1, 31 Jeffreys Road

","Tuesday 20th February, 6:30pm - 9pm - 10 weeks same day and time ","Tuesday 27th February, 6:30pm - 9pm - 10 weeks same day and time ","Tuesday 5th March, 6:30pm - 9pm - 10 weeks same day and time ","Unleash your artistic flair with a 10-week mosaic course, offering flexible scheduling to complete sessions within six months on Tuesday nights.
Start with basic techniques and gradually advance to complex mosaic projects under the guidance of skilled artists with over 20 years of experience.
Enjoy crafting in a serene studio with garden access, ideal for sparking creativity and relaxation.
Dive into a vast selection of mosaic materials to create diverse pieces like tiles, plant pots, mirror frames, and table tops.
Conclude the course with newfound mosaic skills, stunning handmade creations, and the confidence to pursue mosaic making independently.",£276,https://classbento.co.uk/mosaic-making-course-london
