Image link,Event name,Theme,Location,Start date option 1,Start date option 2,Start date option 3,Description,Price,Website
https://classbento.co.uk/images/class_extra/6-week-beginners-pottery-course-deptford-london-1-portrait-big.jpg?1702909925,6 Week Beginners Pottery Course,Pottery,"2 Harton Street, Deptford, SE8 4 DQ

",Monday 26th February 6:30pm - 9pm - 6 weeks same day and time  ,Wednesday 28th February 6:30pm - 9pm - 6 weeks same day and time  ,"Monday 8th April, 6:30pm - 9pm -  6 weeks same day and time","Enhance your pottery skills with our six-week course in Deptford, blending structured lessons with room for personal exploration in clay work.
Ideal for those with some experience, eager to deepen their understanding and proficiency, especially on the pottery wheel.
Course breakdown:
Weeks 1 & 2: Focus on mastering the essentials of throwing techniques.
Week 3: Learn trimming, handle pulling, and explore handbuilding methods.
Week 4: Tackle larger clay quantities, honing skills in coning and wedging.
Week 5: Further trimming and handbuilding, refining shapes and forms.
Week 6: Discover the art of glazing, adding the finishing touches to your pieces.
Dive deeper into clay manipulation, with ample opportunities to practice on the wheel or delve into handbuilding, tailored to your interests and discussions with the tutor.",£280,https://classbento.co.uk/6-week-beginners-pottery-course-deptford-london
https://classbento.co.uk/images/class/5-weeks-ongoing-pottery-course-london-portrait-big.jpg?1700346963,"Etching and Printmaking Course",Arts and Crafts,"Art Hub Studios - Building 28, Westminster Industrial Estate, Unit 2b, 34 Bowater Rd, London, SE18 5TF

","Saturday 17th February, 11am - 1:30pm - 5 weeks same day and time  ","Saturday 24th February, 11am - 1:30pm - 5 weeks same day and time","Saturday 2nd March, 11am - 1:30pm - 5 weeks same day and time","Elevate your pottery skills from beginner to advanced with our comprehensive courses, offering a deep dive into the art of ceramics.
Begin with wheel-throwing basics, crafting your pottery pieces, then progress to intricate techniques like decorating, trimming, and glazing.
Tackle challenging projects involving lids, spouts, and handles, expanding your creative and technical pottery repertoire.
Opt for the 9 or 12-class option to master advanced handbuilding techniques, further enhancing your ability to create complex and detailed ceramic works.",£280,https://classbento.co.uk/5-weeks-ongoing-pottery-course-london
https://classbento.co.uk/images/class/learn-to-sew-make-a-skirt-evening-course-london-portrait-big.jpg?1673458438,"Learn to Sew - Make a Skirt Evening Course",textiles,"Make Mee Studio Crofton Park Community Library - 375 Brockley Rd, Brockley, London SE4 2AG
","Wednesday 21st February,7pm - 9 pm - 6 weeks same day and time ",,,"Dive into dressmaking with our unique, choose-your-own-adventure style sewing class, where you craft the skirt of your dreams.
Master essential techniques: body measuring, pattern terminology, and garment construction basics, laying a solid foundation for future projects.
Customize your skirt with a variety of seams, fastenings, and hems, tailoring it to your personal style with expert guidance.
Progress at your own pace in a supportive environment, led by experienced instructors.
Conclude the class with not only a stylish, wearable skirt but also a sample book of techniques to inspire and guide your future sewing endeavors.",£200,https://classbento.co.uk/learn-to-sew-make-a-skirt-evening-course-london
https://classbento.co.uk/images/class/hand-building-ceramics-course-london-portrait-big.jpg?1694169030,"Hand-building Ceramics Course
",Pottery,"Art Hub Studios - Building 28, Westminster Industrial Estate, Unit 2b, 34 Bowater Rd, London, SE18 5TF

","Saturday 10th February, 11am - 1:30pm - 6 weeks same day and time ","Saturday 13th April, 11am - 1:30pm - 6 weeks same day and time ",,"Embark on a creative journey with Art Hub Studios, exploring the art of hand-building with clay over six engaging Saturday classes.
Master the fundamental techniques: pinching, coiling, and slab building, to shape your unique ceramic pieces.
Experiment with surface decoration, using slips and glazes to add color and texture to your creations.
Suitable for beginners and those looking to advance their skills, with expert tutors to guide you through more complex projects if desired.
The course layout includes an introduction to clay, techniques like pinch and coil, slab building, decoration with slips, and glazing, ensuring a comprehensive pottery experience.
Enjoy a week's break before the final session, allowing your pieces to dry and be fired, ready for the glazing process, and conclude with your own handcrafted ceramics to enhance your home.",£190,https://classbento.co.uk/hand-building-ceramics-course-london
https://classbento.co.uk/images/class_extra/pottery-course-beginners-6-weeks-london-1-portrait-big.jpg?1697795521,Beginners pottery course ,Pottery,"Unit A, Pearl Building, 4 Scena Way, London SE5 0BH

","Saturday 17th February, 10:30am - 1pm - 6 weeks same day and time ","Saturday 20th April, 10:30am - 1pm - 6 weeks same day and time ","Saturday 8th June, 10:30am - 1pm - 6 weeks same day and time ","Embark on a six-week pottery adventure at Urban Potters in Camberwell, London, perfect for both beginners and those looking to polish their skills.
Learn from experienced teachers in a vibrant studio community, sharing stories and techniques with fellow clay enthusiasts.
Master hand-building methods like pinching, coiling, and slab-building, and take the wheel to learn throwing techniques.
Dive into the finishing touches with turning, surface decoration, and glazing, bringing your creations to life.
Understand the essentials of clay preparation and the differences between earthenware and stoneware firings.
Complete the course enriched with comprehensive pottery skills, deeper process insights, and a supportive new circle of fellow potters.",£220,https://classbento.co.uk/pottery-course-beginners-6-weeks-london
https://classbento.co.uk/images/class/alternative-process-photography-course-london-portrait-big.jpg?1679649882,"Alternative Process Photography Course
",Photography,"Pelican house - 144 Cambridge Heath Road, Bethnal Green, London, E1 5QJ
","Tuesday 7th May, 6pm - 8pm - 3 weeks same day and time ",,,"Dive into the intriguing world of photography with a three-week course in London, perfect for enthusiasts and novices alike, exploring unique photographic processes.
Week 1: Discover the art of cyanotypes or image transfer, learning to prepare light-sensitive paper and create stunning artworks, with options to transfer images onto various mediums.
Week 2: Embrace the magic of painting with light, mastering shutter speed to craft captivating light-painted portraits in a collaborative setting.
Week 3: Craft your own pinhole camera from a simple tin, experiencing the classic process of capturing and developing photos in a darkroom.
Walk away with a diverse portfolio of your creations, enriched with both historical insights and modern techniques in photography.",£180,https://classbento.co.uk/alternative-process-photography-course-london
https://classbento.co.uk/images/class/jewellery-rendering-course-designing-in-gouache-london-portrait-big.jpg?1706881032,"Jewellery Rendering Course - Designing in Gouache",Jewellery,"59 Leather Lane, London, EC1N 7, England
","Wednesday 21st February, 6pm - 8:30pm - 4 weeks same day and time ",,,"Dive into the precision of technical jewellery drawing in a workshop designed for all skill levels, from beginners to advanced learners.
Grasp essential tools and techniques to create accurate designs, crucial for clear communication between designers, clients, and craftsmen, ensuring the final piece aligns perfectly with the intended design.
Draw inspiration from your surroundings to cultivate original ideas and enhance your creative skills in jewellery design.
Create a detailed drawing, adding colour and definition to bring your unique design to life, with tailored guidance for each skill level:
Beginners will master basic shapes, settings, and technical drawing with a mechanical pen.
Intermediate learners will design intricate pieces like brooches or earrings, focusing on composition and rendering techniques.
Advanced students will refine personal or professional projects, elevating their design and watercolour rendering skills.
Experience a day of learning with Bibi, your expert instructor, starting with an introduction, skill assessment, and goals discussion, followed by a demonstration of sketching and colouring techniques.
Apply these techniques to your project, choosing from rings, bracelets, necklaces, brooches, or earrings, with Bibi providing personalized guidance and feedback throughout the workshop.",£300,https://classbento.co.uk/jewellery-rendering-course-designing-in-gouache-london
https://classbento.co.uk/images/class/beginners-drawing-course-london-portrait-big.jpg?1657291384,"Beginners Drawing Course
",Arts and Crafts,"ARTS THEATRE - Great Newport Street, London, WC2H 7JB, England


","Thursday 22nd February, 6:45pm - 9:15pm  - 5 weeks same day and time ","Monday 18th March, 6:45pm - 9:15pm  - 5 weeks same day and time ","Thursday 28th March, 6:45pm - 9:15pm  - 5 weeks same day and time ","Embrace tranquility and creativity in our five-session drawing course, perfect for beginners or anyone seeking a creative refresh in a bustling city life.
Engage with various mediums and techniques, starting from quick sketches to detailed still-life compositions, under the guidance of a supportive artist.
Gain confidence and express yourself through observation drawing, understanding proportion, scale, tone, and perspective.
Experiment with a limited palette, learning to sketch using graphite, charcoal, and pastels, and explore colour mixing and brushwork.
Benefit from the experience of painting life models, both nude and clothed, and master the art of capturing the texture of fabrics on canvas.
Enjoy a friendly, welcoming environment with all art supplies provided, making this course an ideal setting to learn, have fun, and unwind.",£198,https://classbento.co.uk/beginners-drawing-course-london
https://classbento.co.uk/images/class/acrylic-painting-course-london-0-portrait-big.jpg?1662740909,"Acrylic Painting Course",Arts and Crafts,"THE MARKET NEXT TO LULU LEMON, Art Play, Old Spitalfields Market 16 Horner Square, London E1 6EW INS
","Monday 4th March, 6:30pm - 8:30pm - 6 weeks same day and time ","Tuesday 12th March, 6:30pm - 8:30pm - 6 weeks same day and time ","Monday 18th March, 6:30pm - 8:30pm - 6 weeks same day and time ","Embark on a six-week painting journey with Art Play London, ideal for beginners eager to explore the joy of creating art from observation, led by the talented Abigail.
Each week, dive into various techniques and mediums including acrylics, pencils, and watercolors, covering a range of art topics to broaden your skills.
Culminate your learning experience by applying your newfound skills to paint a life model, a true test of your observational painting abilities.
Enjoy the benefits of small class sizes for personalized guidance, fostering a warm environment where artistry and friendships flourish.
Please arrive on time to ensure a smooth, enjoyable experience for all, as late arrivals beyond 10 minutes may not be admitted to preserve the class's integrity and respect for all participants.",£190,https://classbento.co.uk/acrylic-painting-course-london-0
https://classbento.co.uk/images/class_extra/8-week-beginners-pottery-course-london-1-portrait-big.jpg?1702896296,"8 Week Beginners Pottery Course",Pottery,"36a Windus Road, Stoke Newington, London, N16 6UP

","Thursday 14th March, 6:30pm - 9pm - 8 weeks same day and time","Thursday 9th May, 6:30pm - 9pm - 8 weeks same day and time",,"Dive into pottery with an 8-week course designed for beginners, ideal for those who enjoyed a taster class or are seeking a creative outlet.
Enjoy a blend of expert tutoring and self-directed learning, enhancing your pottery skills with a focus on wheel throwing and the option for handbuilding.
Weekly breakdown:
Week 1: Master the basics of throwing on the wheel.
Week 2: Learn trimming techniques for pieces from the first session.
Week 3: Challenge yourself with larger clay amounts and advanced techniques like coning and wedging.
Weeks 4-7: Refine your skills, work on personal projects, with Week 4 also covering glazing basics.
Week 8: Complete your creations with final glazing, ready to take home.
Gain confidence, skill, and a collection of handmade pottery, fully experiencing the joy and satisfaction of crafting from start to finish.",£370,https://classbento.co.uk/8-week-beginners-pottery-course-london
https://classbento.co.uk/images/class/comic-and-graphic-novel-drawing-course-london-portrait-big.jpg?1646741280,"Comic and Graphic Novel Drawing Course
",Arts and Crafts,"ARTS THEATRE - Great Newport Street, London, WC2H 7JB, England


",,,,"Unleash your creativity and storytelling skills in a unique art course focused on crafting your very own mini-comic, perfect for those seeking artistic outlets in London.
Dive into the world of comics, drawing inspiration from various genres to develop your narrative and characters, suitable for Marvel enthusiasts, Maus admirers, or Manga fans.
Learn essential techniques to design compelling characters, maintain consistency, and infuse personality into your sketches.
Master the art of paneling and page layout to effectively convey timing and action within your story.
Benefit from expert guidance and personalized feedback from a talented instructor, with all necessary art supplies provided, including pens and template sheets.
Ideal for beginners eager to explore graphic novels and improvers looking to enhance their skills, leaving the course with a completed mini-comic ready for photocopying and sharing.",£125,https://classbento.co.uk/comic-and-graphic-novel-drawing-course-london
https://classbento.co.uk/images/class/magazine-making-course-london-portrait-big.jpg?1679590494,"Magazine Making Course",Arts and Crafts,"Pelican house - 144 Cambridge Heath Road, Bethnal Green, London, E1 5QJ
",,,,"Embark on a journey into the world of magazine publishing with a five-week course at a London studio, perfect for those curious about graphic design and publishing.
Collaborate with an instructor and peers to create a group publication, experiencing every step from conception to print.
Week 1: Dive into magazine basics with insights from an Editor in Chief, and start shaping your magazine's theme.
Week 2: Learn about magazine structure, the power of teamwork, and the essentials of distribution and sales.
Week 3: Get introduced to Adobe InDesign, a key tool in magazine design.
Week 4: Master image selection, text editing, and cover design to craft an engaging publication.
Week 5: Bring all your skills together to finalize the magazine design, readying it for print.
Reconvene two weeks later to receive your printed magazine, a tangible testament to your creativity and collaboration.",£350,https://classbento.co.uk/magazine-making-course-london
https://classbento.co.uk/images/class_extra/introduction-to-floristry-course-london-1-portrait-big.jpg?1666898824,"Introduction to Floristry Course
",Floristry,"Unit 102b, 12-18 Hoxton St, London N1 6NG


","Saturday 9th March, 12pm - 2pm - 4 weeks same day and time","Saturday 13th April, 12pm - 2pm - 4 weeks same day and time","Saturday 4th May, 12pm - 2pm - 4 weeks same day and time","Embark on a four-week floristry journey in London, perfect for beginners eager to explore the art of flower arranging with guidance from expert tutors.
Immerse yourself in a hands-on learning experience, working with fresh flowers and foliage to craft both contemporary and traditional designs.
Gain comprehensive knowledge on flower selection, care, arrangement techniques, wrapping, and presentation.
Course breakdown:
Week 1: Master the art of a hand-tied bouquet with the spiralling technique.
Week 2: Create elegant table center/vase arrangements using chicken wire for structure.
Week 3: Dive into the beauty of dried floral wreaths or craft a charming floral crown.
Week 4: Conclude with a statement piece, such as a floral display on a stand, perfect for weddings or church settings.
Learn from tutors with a distinctive Scandinavian style, known for its high impact and uniqueness, in a welcoming studio environment in Hoxton/Old Street.
Optional opportunity to visit the flower market in Battersea for an early morning adventure.
Complete the course with newfound skills and confidence, ready to create stunning floral arrangements with your personal flair.",£495,https://classbento.co.uk/introduction-to-floristry-course-london
https://classbento.co.uk/images/class_extra/printmaking-course-hard-ground-etching-london-0-1-portrait-big.jpg?1625738998,"Printmaking Course: Hard Ground Etching
",Arts and Crafts,"Vincent’s Yard, 23 Alphabet Mews, London SW9 0FN

",,,,"Dive into the world of printmaking with our engaging workshops in London, perfect for personalizing your art or exploring new creative avenues.
Learn the classic technique of hard ground etching, ideal for crafting monochrome images ranging from urban vistas to abstract designs and expressive portraits.
Benefit from the expertise of a seasoned printmaker, who will guide you through the nuances of etching, from layering tone and pattern to choosing the right inks for your artwork.
Discover essential maintenance tips to keep your etching plate in top condition, ensuring the finest quality prints.
Suitable for all levels, this three-week course is a great starting point for beginners or a valuable skill enhancer for experienced artists.
Whether aiming to create a unique gift or embark on a rewarding hobby, find satisfaction in the versatile and gratifying process of printmaking.",£165,https://classbento.co.uk/printmaking-course-hard-ground-etching-london-0